{
  "source": {
    "provider": "local",
    "resource": "authored-example",
    "version": "1",
    "translator": "Example author",
    "license": "test-only",
    "attribution": "Authored example, not an identified creator translation",
    "direction": "ltr"
  },
  "corpus": {
    "edition": "Tanzil Simple Hafs",
    "version": "1.1",
    "sha256": "f3268cfe7a400add8a8024fe23368d66f58cc8baa51773fe94e323625c66344b"
  },
  "bindings": [
    {
      "binding_id": "phrase",
      "revision": "1",
      "spans": [
        {
          "surah": 31,
          "ayah": 9,
          "word_start": 1,
          "word_end": 5
        }
      ],
      "arabic_sha256": "ac13ac552e5307c4b4a955b1ac8cfdc9d866570044b5dd84a38e480275c68cac",
      "source_text": "staying there forever. Allah's promise is true.",
      "source_text_sha256": "5d068b352e1d6b337aa5f7785b6e14205ea0e97bbfc9c640da04c69af8328ad0",
      "segments": [
        "staying there forever. Allah's promise is true."
      ],
      "review_status": "approved",
      "reviewer": "Authored example fixture",
      "edited": false,
      "mapping_revision": "simple-uthmani-2",
      "source_identity_sha256": "4cef2ac1e5b08c722f88143935d2b4c9274dcc0d7b8955ad9a5bb84348566dd6"
    }
  ],
  "schema_version": 1
}